"UPPLAND, Sectional, 4-seat corner, Kelinge rust","1,649",https://www.ikea.com/us/en/p/uppland-sectional-4-seat-corner-kelinge-rust-s79508185/,images/uppland.jpg,"Blekinge white, Hakebo dark gray, Hakebo gray/green, Hillared anthracite, Hillared beige, Hillared dark blue, Karlshov gray-beige, Kelinge anthracite, Kelinge beige, Kelinge gray-turquoise, Current variation Kelinge rust, Kilanda dark blue, Kilanda light beige"
"UPPLAND, Sectional, 4-seat corner, Kelinge anthracite","1,649",https://www.ikea.com/us/en/p/uppland-sectional-4-seat-corner-kelinge-anthracite-s79508190/,images/uppland.jpg,"Blekinge white, Hakebo dark gray, Hakebo gray/green, Hillared anthracite, Hillared beige, Hillared dark blue, Karlshov gray-beige, Current variation Kelinge anthracite, Kelinge beige, Kelinge gray-turquoise, Kelinge rust, Kilanda dark blue, Kilanda light beige"
"HÄRLANDA, Sleeper sofa, Sporda natural","1,449",https://www.ikea.com/us/en/p/haerlanda-sleeper-sofa-sporda-natural-s69542793/,images/härlanda.jpg,"Inseros white, Ljungen light green, Ljungen light red, Ljungen medium gray, Sporda dark gray, Current variation Sporda natural"
"HÄRLANDA, Sleeper sofa, Inseros white","1,349",https://www.ikea.com/us/en/p/haerlanda-sleeper-sofa-inseros-white-s19542781/,images/härlanda.jpg,"Current variation Inseros white, Ljungen light green, Ljungen light red, Ljungen medium gray, Sporda dark gray, Sporda natural"
"HÄRLANDA, Sleeper sofa, Ljungen medium gray","1,399",https://www.ikea.com/us/en/p/haerlanda-sleeper-sofa-ljungen-medium-gray-s59542784/,images/härlanda.jpg,"Inseros white, Ljungen light green, Ljungen light red, Current variation Ljungen medium gray, Sporda dark gray, Sporda natural"
"HÄRLANDA, Sleeper sofa, Ljungen light red","1,399",https://www.ikea.com/us/en/p/haerlanda-sleeper-sofa-ljungen-light-red-s79542783/,images/härlanda.jpg,"Inseros white, Ljungen light green, Current variation Ljungen light red, Ljungen medium gray, Sporda dark gray, Sporda natural"
"HÄRLANDA, Sleeper sofa, Sporda dark gray","1,449",https://www.ikea.com/us/en/p/haerlanda-sleeper-sofa-sporda-dark-gray-s89542792/,images/härlanda.jpg,"Inseros white, Ljungen light green, Ljungen light red, Ljungen medium gray, Current variation Sporda dark gray, Sporda natural"
"BACKSÄLEN, Loveseat, Hallarp gray",649,https://www.ikea.com/us/en/p/backsaelen-loveseat-hallarp-gray-s49393176/,images/backsälen.jpg,"Blekinge white, Current variation Hallarp gray, Katorp natural"
"BACKSÄLEN, Loveseat, Katorp natural",649,https://www.ikea.com/us/en/p/backsaelen-loveseat-katorp-natural-s49393181/,images/backsälen.jpg,"Blekinge white, Hallarp gray, Current variation Katorp natural"
"HÄRLANDA, Sectional, 4-seat, with chaise/Sporda natural","2,299",https://www.ikea.com/us/en/p/haerlanda-sectional-4-seat-with-chaise-sporda-natural-s09320318/,images/härlanda.jpg,"With chaise/Inseros white, With chaise/Ljungen light green, With chaise/Ljungen light red, With chaise/Ljungen medium gray, With chaise/Sporda dark gray, Current variation With chaise/Sporda natural"
"HÄRLANDA, Sectional, 4-seat, with chaise/Inseros white","2,099",https://www.ikea.com/us/en/p/haerlanda-sectional-4-seat-with-chaise-inseros-white-s19320308/,images/härlanda.jpg,"Current variation With chaise/Inseros white, With chaise/Ljungen light green, With chaise/Ljungen light red, With chaise/Ljungen medium gray, With chaise/Sporda dark gray, With chaise/Sporda natural"
"HÄRLANDA, Sectional, 4-seat, with chaise/Ljungen light green","2,149",https://www.ikea.com/us/en/p/haerlanda-sectional-4-seat-with-chaise-ljungen-light-green-s39320312/,images/härlanda.jpg,"With chaise/Inseros white, Current variation With chaise/Ljungen light green, With chaise/Ljungen light red, With chaise/Ljungen medium gray, With chaise/Sporda dark gray, With chaise/Sporda natural"
"HÄRLANDA, Sectional, 4-seat, with chaise/Sporda dark gray","2,299",https://www.ikea.com/us/en/p/haerlanda-sectional-4-seat-with-chaise-sporda-dark-gray-s49320316/,images/härlanda.jpg,"With chaise/Inseros white, With chaise/Ljungen light green, With chaise/Ljungen light red, With chaise/Ljungen medium gray, Current variation With chaise/Sporda dark gray, With chaise/Sporda natural"
"HÄRLANDA, Sectional, 4-seat, with chaise/Ljungen light red","2,149",https://www.ikea.com/us/en/p/haerlanda-sectional-4-seat-with-chaise-ljungen-light-red-s79320310/,images/härlanda.jpg,"With chaise/Inseros white, With chaise/Ljungen light green, Current variation With chaise/Ljungen light red, With chaise/Ljungen medium gray, With chaise/Sporda dark gray, With chaise/Sporda natural"
"JÄTTEBO, 4.5-seat mod sofa, Samsala dark yellow-green","1,740",https://www.ikea.com/us/en/p/jaettebo-4-5-seat-mod-sofa-samsala-dark-yellow-green-s49485091/,images/jättebo.jpg,"Current variation Samsala dark yellow-green, Samsala gray-beige, Tonerud gray"
"JÄTTEBO, 4.5-seat mod sofa, Tonerud gray","1,695",https://www.ikea.com/us/en/p/jaettebo-4-5-seat-mod-sofa-tonerud-gray-s99485079/,images/jättebo.jpg,"Samsala dark yellow-green, Samsala gray-beige, Current variation Tonerud gray"
"VRETSTORP, Sleeper sofa, Kilanda light beige","1,049",https://www.ikea.com/us/en/p/vretstorp-sleeper-sofa-kilanda-light-beige-s79491241/,images/vretstorp.jpg,"Hakebo dark gray, Hakebo gray-green, Karlshov gray-beige, Kilanda dark blue, Current variation Kilanda light beige"
"VRETSTORP, Sleeper sofa, Kilanda dark blue","1,049",https://www.ikea.com/us/en/p/vretstorp-sleeper-sofa-kilanda-dark-blue-s49491247/,images/vretstorp.jpg,"Hakebo dark gray, Hakebo gray-green, Karlshov gray-beige, Current variation Kilanda dark blue, Kilanda light beige"
"VRETSTORP, Sleeper sofa, Hakebo gray-green",999,https://www.ikea.com/us/en/p/vretstorp-sleeper-sofa-hakebo-gray-green-s99491259/,images/vretstorp.jpg,"Hakebo dark gray, Current variation Hakebo gray-green, Karlshov gray-beige, Kilanda dark blue, Kilanda light beige"
"VRETSTORP, Sleeper sofa, Karlshov gray-beige","1,099",https://www.ikea.com/us/en/p/vretstorp-sleeper-sofa-karlshov-gray-beige-s99491235/,images/vretstorp.jpg,"Hakebo dark gray, Hakebo gray-green, Current variation Karlshov gray-beige, Kilanda dark blue, Kilanda light beige"
"LÅNGARYD, Sofa, Lejde gray/black/metal","1,799",https://www.ikea.com/us/en/p/langaryd-sofa-lejde-gray-black-metal-s09506043/,images/långaryd.jpg,"Current variation Lejde gray/black, Lejde light gray"
"LÅNGARYD, Sofa, Lejde light gray/wood","1,799",https://www.ikea.com/us/en/p/langaryd-sofa-lejde-light-gray-wood-s39506046/,images/långaryd.jpg,"Lejde gray/black, Current variation Lejde light gray"
"LÅNGARYD, Sofa, Lejde light gray/metal","1,799",https://www.ikea.com/us/en/p/langaryd-sofa-lejde-light-gray-metal-s59506045/,images/långaryd.jpg,"Lejde gray/black, Current variation Lejde light gray"
"SÖDERHAMN, Sectional, 4-seat with chaise, with open end Gransel/natural","1,119",https://www.ikea.com/us/en/p/soederhamn-sectional-4-seat-with-chaise-with-open-end-gransel-natural-s29442154/,images/söderhamn.jpg,"And open end Fridtuna/dark gray, And open end Kelinge/rust, And open end Tonerud/gray, And open end Tonerud/red, And open end/Fridtuna light beige, With chaise and open end/Viarp beige/brown, Current variation With open end Gransel/natural"
"SÖDERHAMN, Sectional, 4-seat with chaise, and open end Fridtuna/dark gray","1,119",https://www.ikea.com/us/en/p/soederhamn-sectional-4-seat-with-chaise-and-open-end-fridtuna-dark-gray-s19449636/,images/söderhamn.jpg,"Current variation And open end Fridtuna/dark gray, And open end Kelinge/rust, And open end Tonerud/gray, And open end Tonerud/red, And open end/Fridtuna light beige, With chaise and open end/Viarp beige/brown, With open end Gransel/natural"
"SÖDERHAMN, Sectional, 4-seat with chaise, and open end/Fridtuna light beige","1,119",https://www.ikea.com/us/en/p/soederhamn-sectional-4-seat-with-chaise-and-open-end-fridtuna-light-beige-s29449706/,images/söderhamn.jpg,"And open end Fridtuna/dark gray, And open end Kelinge/rust, And open end Tonerud/gray, And open end Tonerud/red, Current variation And open end/Fridtuna light beige, With chaise and open end/Viarp beige/brown, With open end Gransel/natural"
"SÖDERHAMN, Sectional, 4-seat with chaise, and open end Tonerud/gray",939,https://www.ikea.com/us/en/p/soederhamn-sectional-4-seat-with-chaise-and-open-end-tonerud-gray-s49452118/,images/söderhamn.jpg,"And open end Fridtuna/dark gray, And open end Kelinge/rust, Current variation And open end Tonerud/gray, And open end Tonerud/red, And open end/Fridtuna light beige, With chaise and open end/Viarp beige/brown, With open end Gransel/natural"
"SÖDERHAMN, Sectional, 4-seat with chaise, and open end Tonerud/red",939,https://www.ikea.com/us/en/p/soederhamn-sectional-4-seat-with-chaise-and-open-end-tonerud-red-s99514473/,images/söderhamn.jpg,"And open end Fridtuna/dark gray, And open end Kelinge/rust, And open end Tonerud/gray, Current variation And open end Tonerud/red, And open end/Fridtuna light beige, With chaise and open end/Viarp beige/brown, With open end Gransel/natural"
"HYLTARP, Sleeper sofa, Hallarp white","1,399",https://www.ikea.com/us/en/p/hyltarp-sleeper-sofa-hallarp-white-s69489597/,images/hyltarp.jpg,"Gransel gray, Gransel gray-brown, Gransel natural, Current variation Hallarp white, Hemmesta gray-green, Hemmesta light beige, Kilanda pale blue, Tallmyra blue, Tallmyra dark green, Tallmyra white/black"
"HYLTARP, Sleeper sofa, Gransel gray","1,449",https://www.ikea.com/us/en/p/hyltarp-sleeper-sofa-gransel-gray-s19514863/,images/hyltarp.jpg,"Current variation Gransel gray, Gransel gray-brown, Gransel natural, Hallarp white, Hemmesta gray-green, Hemmesta light beige, Kilanda pale blue, Tallmyra blue, Tallmyra dark green, Tallmyra white/black"
"HYLTARP, Sleeper sofa, Kilanda pale blue","1,399",https://www.ikea.com/us/en/p/hyltarp-sleeper-sofa-kilanda-pale-blue-s89489596/,images/hyltarp.jpg,"Gransel gray, Gransel gray-brown, Gransel natural, Hallarp white, Hemmesta gray-green, Hemmesta light beige, Current variation Kilanda pale blue, Tallmyra blue, Tallmyra dark green, Tallmyra white/black"
"HYLTARP, Sleeper sofa, Hemmesta light beige","1,499",https://www.ikea.com/us/en/p/hyltarp-sleeper-sofa-hemmesta-light-beige-s59514875/,images/hyltarp.jpg,"Gransel gray, Gransel gray-brown, Gransel natural, Hallarp white, Hemmesta gray-green, Current variation Hemmesta light beige, Kilanda pale blue, Tallmyra blue, Tallmyra dark green, Tallmyra white/black"
"HYLTARP, Sleeper sofa, Hemmesta gray-green","1,499",https://www.ikea.com/us/en/p/hyltarp-sleeper-sofa-hemmesta-gray-green-s69514870/,images/hyltarp.jpg,"Gransel gray, Gransel gray-brown, Gransel natural, Hallarp white, Current variation Hemmesta gray-green, Hemmesta light beige, Kilanda pale blue, Tallmyra blue, Tallmyra dark green, Tallmyra white/black"
"HYLTARP, Sleeper sofa, Gransel gray-brown","1,449",https://www.ikea.com/us/en/p/hyltarp-sleeper-sofa-gransel-gray-brown-s49489602/,images/hyltarp.jpg,"Gransel gray, Current variation Gransel gray-brown, Gransel natural, Hallarp white, Hemmesta gray-green, Hemmesta light beige, Kilanda pale blue, Tallmyra blue, Tallmyra dark green, Tallmyra white/black"
"HYLTARP, Sleeper sofa, Tallmyra dark green","1,499",https://www.ikea.com/us/en/p/hyltarp-sleeper-sofa-tallmyra-dark-green-s09514887/,images/hyltarp.jpg,"Gransel gray, Gransel gray-brown, Gransel natural, Hallarp white, Hemmesta gray-green, Hemmesta light beige, Kilanda pale blue, Tallmyra blue, Current variation Tallmyra dark green, Tallmyra white/black"
"HYLTARP, Sleeper sofa, Tallmyra white/black","1,499",https://www.ikea.com/us/en/p/hyltarp-sleeper-sofa-tallmyra-white-black-s09514892/,images/hyltarp.jpg,"Gransel gray, Gransel gray-brown, Gransel natural, Hallarp white, Hemmesta gray-green, Hemmesta light beige, Kilanda pale blue, Tallmyra blue, Tallmyra dark green, Current variation Tallmyra white/black"
"HYLTARP, Sleeper sofa, Tallmyra blue","1,499",https://www.ikea.com/us/en/p/hyltarp-sleeper-sofa-tallmyra-blue-s39514881/,images/hyltarp.jpg,"Gransel gray, Gransel gray-brown, Gransel natural, Hallarp white, Hemmesta gray-green, Hemmesta light beige, Kilanda pale blue, Current variation Tallmyra blue, Tallmyra dark green, Tallmyra white/black"
"JÄTTEBO, Modular loveseat, Samsala gray-beige","1,500",https://www.ikea.com/us/en/p/jaettebo-modular-loveseat-samsala-gray-beige-s89471412/,images/jättebo.jpg,"Samsala dark yellow-green, Current variation Samsala gray-beige, Tonerud gray"
"JÄTTEBO, Modular loveseat, Tonerud gray","1,450",https://www.ikea.com/us/en/p/jaettebo-modular-loveseat-tonerud-gray-s49469500/,images/jättebo.jpg,"Samsala dark yellow-green, Samsala gray-beige, Current variation Tonerud gray"
"MORABO, Sleeper sofa, Gunnared light green/wood","1,199",https://www.ikea.com/us/en/p/morabo-sleeper-sofa-gunnared-light-green-wood-s59491322/,images/morabo.jpg,"Gunnared dark gray/metal, Gunnared dark gray/wood, Gunnared light green/metal, Current variation Gunnared light green/wood"
"MORABO, Sleeper sofa, Gunnared dark gray/metal","1,199",https://www.ikea.com/us/en/p/morabo-sleeper-sofa-gunnared-dark-gray-metal-s69491326/,images/morabo.jpg,"Current variation Gunnared dark gray/metal, Gunnared dark gray/wood, Gunnared light green/metal, Gunnared light green/wood"
"MORABO, Sleeper sofa, Gunnared light green/metal","1,199",https://www.ikea.com/us/en/p/morabo-sleeper-sofa-gunnared-light-green-metal-s89491325/,images/morabo.jpg,"Gunnared dark gray/metal, Gunnared dark gray/wood, Current variation Gunnared light green/metal, Gunnared light green/wood"
"KIVIK, Sectional 6-seat crn/chaise, Gunnared blue","2,099",https://www.ikea.com/us/en/p/kivik-sectional-6-seat-crn-chaise-gunnared-blue-s59499629/,images/kivik.jpg,"Gunnared beige, Current variation Gunnared blue, Gunnared light brown-pink, Gunnared light green, Gunnared medium gray, Kelinge gray-turquoise, Tallmyra blue, Tallmyra dark green, Tallmyra light green, Tallmyra white/black, Tibbleby beige/gray, Tresund anthracite, Tresund light beige"
"KIVIK, Sectional 6-seat crn/chaise, Kelinge gray-turquoise","1,949",https://www.ikea.com/us/en/p/kivik-sectional-6-seat-crn-chaise-kelinge-gray-turquoise-s79443028/,images/kivik.jpg,"Gunnared beige, Gunnared blue, Gunnared light brown-pink, Gunnared light green, Gunnared medium gray, Current variation Kelinge gray-turquoise, Tallmyra blue, Tallmyra dark green, Tallmyra light green, Tallmyra white/black, Tibbleby beige/gray, Tresund anthracite, Tresund light beige"
"KIVIK, Sectional 6-seat crn/chaise, Tresund light beige","2,099",https://www.ikea.com/us/en/p/kivik-sectional-6-seat-crn-chaise-tresund-light-beige-s79482883/,images/kivik.jpg,"Gunnared beige, Gunnared blue, Gunnared light brown-pink, Gunnared light green, Gunnared medium gray, Kelinge gray-turquoise, Tallmyra blue, Tallmyra dark green, Tallmyra light green, Tallmyra white/black, Tibbleby beige/gray, Tresund anthracite, Current variation Tresund light beige"
"KIVIK, Sectional 6-seat crn/chaise, Tresund anthracite","2,099",https://www.ikea.com/us/en/p/kivik-sectional-6-seat-crn-chaise-tresund-anthracite-s59482884/,images/kivik.jpg,"Gunnared beige, Gunnared blue, Gunnared light brown-pink, Gunnared light green, Gunnared medium gray, Kelinge gray-turquoise, Tallmyra blue, Tallmyra dark green, Tallmyra light green, Tallmyra white/black, Tibbleby beige/gray, Current variation Tresund anthracite, Tresund light beige"
"KIVIK, Sectional 6-seat crn/chaise, Gunnared medium gray","2,099",https://www.ikea.com/us/en/p/kivik-sectional-6-seat-crn-chaise-gunnared-medium-gray-s99499632/,images/kivik.jpg,"Gunnared beige, Gunnared blue, Gunnared light brown-pink, Gunnared light green, Current variation Gunnared medium gray, Kelinge gray-turquoise, Tallmyra blue, Tallmyra dark green, Tallmyra light green, Tallmyra white/black, Tibbleby beige/gray, Tresund anthracite, Tresund light beige"
"KIVIK, Sectional 6-seat crn/chaise, Tallmyra light green","2,249",https://www.ikea.com/us/en/p/kivik-sectional-6-seat-crn-chaise-tallmyra-light-green-s09499636/,images/kivik.jpg,"Gunnared beige, Gunnared blue, Gunnared light brown-pink, Gunnared light green, Gunnared medium gray, Kelinge gray-turquoise, Tallmyra blue, Tallmyra dark green, Current variation Tallmyra light green, Tallmyra white/black, Tibbleby beige/gray, Tresund anthracite, Tresund light beige"
"KIVIK, Sectional 6-seat crn/chaise, Tallmyra dark green","2,249",https://www.ikea.com/us/en/p/kivik-sectional-6-seat-crn-chaise-tallmyra-dark-green-s29499635/,images/kivik.jpg,"Gunnared beige, Gunnared blue, Gunnared light brown-pink, Gunnared light green, Gunnared medium gray, Kelinge gray-turquoise, Tallmyra blue, Current variation Tallmyra dark green, Tallmyra light green, Tallmyra white/black, Tibbleby beige/gray, Tresund anthracite, Tresund light beige"
"KIVIK, Sectional 6-seat crn/chaise, Tallmyra blue","2,249",https://www.ikea.com/us/en/p/kivik-sectional-6-seat-crn-chaise-tallmyra-blue-s59499634/,images/kivik.jpg,"Gunnared beige, Gunnared blue, Gunnared light brown-pink, Gunnared light green, Gunnared medium gray, Kelinge gray-turquoise, Current variation Tallmyra blue, Tallmyra dark green, Tallmyra light green, Tallmyra white/black, Tibbleby beige/gray, Tresund anthracite, Tresund light beige"
"KIVIK, Sectional 6-seat crn/chaise, Gunnared light green","2,099",https://www.ikea.com/us/en/p/kivik-sectional-6-seat-crn-chaise-gunnared-light-green-s19499631/,images/kivik.jpg,"Gunnared beige, Gunnared blue, Gunnared light brown-pink, Current variation Gunnared light green, Gunnared medium gray, Kelinge gray-turquoise, Tallmyra blue, Tallmyra dark green, Tallmyra light green, Tallmyra white/black, Tibbleby beige/gray, Tresund anthracite, Tresund light beige"
"KIVIK, Sectional 6-seat crn/chaise, Gunnared light brown-pink","2,099",https://www.ikea.com/us/en/p/kivik-sectional-6-seat-crn-chaise-gunnared-light-brown-pink-s39499630/,images/kivik.jpg,"Gunnared beige, Gunnared blue, Current variation Gunnared light brown-pink, Gunnared light green, Gunnared medium gray, Kelinge gray-turquoise, Tallmyra blue, Tallmyra dark green, Tallmyra light green, Tallmyra white/black, Tibbleby beige/gray, Tresund anthracite, Tresund light beige"
"MORABO, Sectional, 5-seat corner, Gunnared light green/wood","1,799",https://www.ikea.com/us/en/p/morabo-sectional-5-seat-corner-gunnared-light-green-wood-s19318329/,images/morabo.jpg,"Djuparp dark blue, Gunnared dark gray, Current variation Gunnared light green"
"MORABO, Sectional, 5-seat corner, Djuparp dark blue/wood","1,999",https://www.ikea.com/us/en/p/morabo-sectional-5-seat-corner-djuparp-dark-blue-wood-s59416498/,images/morabo.jpg,"Current variation Djuparp dark blue, Gunnared dark gray, Gunnared light green"
"MORABO, Sectional, 5-seat corner, Gunnared dark gray/metal","1,799",https://www.ikea.com/us/en/p/morabo-sectional-5-seat-corner-gunnared-dark-gray-metal-s19318310/,images/morabo.jpg,"Djuparp dark blue, Current variation Gunnared dark gray, Gunnared light green"
"MORABO, Sectional, 5-seat corner, Gunnared light green/metal","1,799",https://www.ikea.com/us/en/p/morabo-sectional-5-seat-corner-gunnared-light-green-metal-s39318328/,images/morabo.jpg,"Djuparp dark blue, Gunnared dark gray, Current variation Gunnared light green"
"MORABO, Sectional, 5-seat corner, Djuparp dark blue/metal","1,999",https://www.ikea.com/us/en/p/morabo-sectional-5-seat-corner-djuparp-dark-blue-metal-s79416497/,images/morabo.jpg,"Current variation Djuparp dark blue, Gunnared dark gray, Gunnared light green"
"HÄRLANDA, Loveseat, Sporda natural","1,099",https://www.ikea.com/us/en/p/haerlanda-loveseat-sporda-natural-s89320258/,images/härlanda.jpg,"Inseros white, Ljungen light green, Ljungen light red, Ljungen medium gray, Sporda dark gray, Current variation Sporda natural"
"HÄRLANDA, Loveseat, Ljungen light red","1,049",https://www.ikea.com/us/en/p/haerlanda-loveseat-ljungen-light-red-s59320250/,images/härlanda.jpg,"Inseros white, Ljungen light green, Current variation Ljungen light red, Ljungen medium gray, Sporda dark gray, Sporda natural"
"HÄRLANDA, Loveseat, Ljungen light green","1,049",https://www.ikea.com/us/en/p/haerlanda-loveseat-ljungen-light-green-s19320252/,images/härlanda.jpg,"Inseros white, Current variation Ljungen light green, Ljungen light red, Ljungen medium gray, Sporda dark gray, Sporda natural"
"HÄRLANDA, Loveseat, Sporda dark gray","1,099",https://www.ikea.com/us/en/p/haerlanda-loveseat-sporda-dark-gray-s29320256/,images/härlanda.jpg,"Inseros white, Ljungen light green, Ljungen light red, Ljungen medium gray, Current variation Sporda dark gray, Sporda natural"
"HÄRLANDA, Loveseat, Inseros white",999,https://www.ikea.com/us/en/p/haerlanda-loveseat-inseros-white-s99320248/,images/härlanda.jpg,"Current variation Inseros white, Ljungen light green, Ljungen light red, Ljungen medium gray, Sporda dark gray, Sporda natural"
"KIVIK, Sectional, 4-seat corner, Tresund light beige","1,549",https://www.ikea.com/us/en/p/kivik-sectional-4-seat-corner-tresund-light-beige-s59482860/,images/kivik.jpg,"Gunnared beige, Gunnared blue, Gunnared light brown-pink, Gunnared light green, Gunnared medium gray, Kelinge gray-turquoise, Tallmyra blue, Tallmyra dark green, Tallmyra light green, Tallmyra white/black, Tibbleby beige/gray, Tresund anthracite, Current variation Tresund light beige"
"KIVIK, Sectional, 4-seat corner, Kelinge gray-turquoise","1,449",https://www.ikea.com/us/en/p/kivik-sectional-4-seat-corner-kelinge-gray-turquoise-s29443016/,images/kivik.jpg,"Gunnared beige, Gunnared blue, Gunnared light brown-pink, Gunnared light green, Gunnared medium gray, Current variation Kelinge gray-turquoise, Tallmyra blue, Tallmyra dark green, Tallmyra light green, Tallmyra white/black, Tibbleby beige/gray, Tresund anthracite, Tresund light beige"
"KIVIK, Sectional, 4-seat corner, Gunnared medium gray","1,549",https://www.ikea.com/us/en/p/kivik-sectional-4-seat-corner-gunnared-medium-gray-s09499599/,images/kivik.jpg,"Gunnared beige, Gunnared blue, Gunnared light brown-pink, Gunnared light green, Current variation Gunnared medium gray, Kelinge gray-turquoise, Tallmyra blue, Tallmyra dark green, Tallmyra light green, Tallmyra white/black, Tibbleby beige/gray, Tresund anthracite, Tresund light beige"
"KIVIK, Sectional, 4-seat corner, Tresund anthracite","1,549",https://www.ikea.com/us/en/p/kivik-sectional-4-seat-corner-tresund-anthracite-s79482859/,images/kivik.jpg,"Gunnared beige, Gunnared blue, Gunnared light brown-pink, Gunnared light green, Gunnared medium gray, Kelinge gray-turquoise, Tallmyra blue, Tallmyra dark green, Tallmyra light green, Tallmyra white/black, Tibbleby beige/gray, Current variation Tresund anthracite, Tresund light beige"
"KIVIK, Sectional, 4-seat corner, Tallmyra blue","1,649",https://www.ikea.com/us/en/p/kivik-sectional-4-seat-corner-tallmyra-blue-s49499601/,images/kivik.jpg,"Gunnared beige, Gunnared blue, Gunnared light brown-pink, Gunnared light green, Gunnared medium gray, Kelinge gray-turquoise, Current variation Tallmyra blue, Tallmyra dark green, Tallmyra light green, Tallmyra white/black, Tibbleby beige/gray, Tresund anthracite, Tresund light beige"
"KIVIK, Sectional, 4-seat corner, Tallmyra light green","1,649",https://www.ikea.com/us/en/p/kivik-sectional-4-seat-corner-tallmyra-light-green-s09499603/,images/kivik.jpg,"Gunnared beige, Gunnared blue, Gunnared light brown-pink, Gunnared light green, Gunnared medium gray, Kelinge gray-turquoise, Tallmyra blue, Tallmyra dark green, Current variation Tallmyra light green, Tallmyra white/black, Tibbleby beige/gray, Tresund anthracite, Tresund light beige"
"KIVIK, Sectional, 4-seat corner, Gunnared light brown-pink","1,549",https://www.ikea.com/us/en/p/kivik-sectional-4-seat-corner-gunnared-light-brown-pink-s49499597/,images/kivik.jpg,"Gunnared beige, Gunnared blue, Current variation Gunnared light brown-pink, Gunnared light green, Gunnared medium gray, Kelinge gray-turquoise, Tallmyra blue, Tallmyra dark green, Tallmyra light green, Tallmyra white/black, Tibbleby beige/gray, Tresund anthracite, Tresund light beige"
"KIVIK, Sectional, 4-seat corner, Tallmyra dark green","1,649",https://www.ikea.com/us/en/p/kivik-sectional-4-seat-corner-tallmyra-dark-green-s29499602/,images/kivik.jpg,"Gunnared beige, Gunnared blue, Gunnared light brown-pink, Gunnared light green, Gunnared medium gray, Kelinge gray-turquoise, Tallmyra blue, Current variation Tallmyra dark green, Tallmyra light green, Tallmyra white/black, Tibbleby beige/gray, Tresund anthracite, Tresund light beige"
"KIVIK, Sectional, 4-seat corner, Gunnared light green","1,549",https://www.ikea.com/us/en/p/kivik-sectional-4-seat-corner-gunnared-light-green-s29499598/,images/kivik.jpg,"Gunnared beige, Gunnared blue, Gunnared light brown-pink, Current variation Gunnared light green, Gunnared medium gray, Kelinge gray-turquoise, Tallmyra blue, Tallmyra dark green, Tallmyra light green, Tallmyra white/black, Tibbleby beige/gray, Tresund anthracite, Tresund light beige"
"KIVIK, Sectional, 4-seat corner, Gunnared blue","1,549",https://www.ikea.com/us/en/p/kivik-sectional-4-seat-corner-gunnared-blue-s69499596/,images/kivik.jpg,"Gunnared beige, Current variation Gunnared blue, Gunnared light brown-pink, Gunnared light green, Gunnared medium gray, Kelinge gray-turquoise, Tallmyra blue, Tallmyra dark green, Tallmyra light green, Tallmyra white/black, Tibbleby beige/gray, Tresund anthracite, Tresund light beige"
"FINNALA, Sofa, with open end/Tallmyra black/gray","1,363",https://www.ikea.com/us/en/p/finnala-sofa-with-open-end-tallmyra-black-gray-s09319094/,images/finnala.jpg,"With open end/Dalstorp multicolor, With open end/Gunnared beige, With open end/Gunnared medium gray, With open end/Orrsta black-blue, With open end/Tallmyra beige, Current variation With open end/Tallmyra black/gray"
