"FINNALA, Armrest, Orrsta black-blue",115,https://www.ikea.com/us/en/p/finnala-armrest-orrsta-black-blue-s39319573/,images/finnala.jpg,"Dalstorp multicolor, Gunnared beige, Gunnared medium gray, Current variation Orrsta black-blue, Tallmyra beige, Tallmyra black/gray"
"JÄTTEBO, Armrest, Tonerud gray",210,https://www.ikea.com/us/en/p/jaettebo-armrest-tonerud-gray-s59471456/,images/jättebo.jpg,"Samsala dark yellow-green, Samsala gray-beige, Current variation Tonerud gray"
"JÄTTEBO, Armrest, Samsala gray-beige",220,https://www.ikea.com/us/en/p/jaettebo-armrest-samsala-gray-beige-s39471457/,images/jättebo.jpg,"Samsala dark yellow-green, Current variation Samsala gray-beige, Tonerud gray"
"HÄRLANDA, Armrest, Sporda natural",125,https://www.ikea.com/us/en/p/haerlanda-armrest-sporda-natural-s59320165/,images/härlanda.jpg,"Inseros white, Ljungen light green, Ljungen light red, Ljungen medium gray, Sporda dark gray, Current variation Sporda natural"
"HÄRLANDA, Armrest, Inseros white",105,https://www.ikea.com/us/en/p/haerlanda-armrest-inseros-white-s69320155/,images/härlanda.jpg,"Current variation Inseros white, Ljungen light green, Ljungen light red, Ljungen medium gray, Sporda dark gray, Sporda natural"
"HÄRLANDA, Armrest, Ljungen light red",115,https://www.ikea.com/us/en/p/haerlanda-armrest-ljungen-light-red-s29320157/,images/härlanda.jpg,"Inseros white, Ljungen light green, Current variation Ljungen light red, Ljungen medium gray, Sporda dark gray, Sporda natural"
"HÄRLANDA, Armrest, Ljungen light green",115,https://www.ikea.com/us/en/p/haerlanda-armrest-ljungen-light-green-s89320159/,images/härlanda.jpg,"Inseros white, Current variation Ljungen light green, Ljungen light red, Ljungen medium gray, Sporda dark gray, Sporda natural"
"KIVIK, Sofa with chaise, Tibbleby beige/gray","1,149",https://www.ikea.com/us/en/p/kivik-sofa-with-chaise-tibbleby-beige-gray-s79440586/,images/kivik.jpg,"Gunnared beige, Gunnared blue, Gunnared light brown-pink, Gunnared light green, Gunnared medium gray, Kelinge gray-turquoise, Tallmyra blue, Tallmyra dark green, Tallmyra light green, Tallmyra white/black, Current variation Tibbleby beige/gray, Tresund anthracite, Tresund light beige"
"KIVIK, Sofa with chaise, Kelinge gray-turquoise","1,199",https://www.ikea.com/us/en/p/kivik-sofa-with-chaise-kelinge-gray-turquoise-s49443058/,images/kivik.jpg,"Gunnared beige, Gunnared blue, Gunnared light brown-pink, Gunnared light green, Gunnared medium gray, Current variation Kelinge gray-turquoise, Tallmyra blue, Tallmyra dark green, Tallmyra light green, Tallmyra white/black, Tibbleby beige/gray, Tresund anthracite, Tresund light beige"
"KIVIK, Sofa with chaise, Gunnared beige","1,299",https://www.ikea.com/us/en/p/kivik-sofa-with-chaise-gunnared-beige-s09499702/,images/kivik.jpg,"Current variation Gunnared beige, Gunnared blue, Gunnared light brown-pink, Gunnared light green, Gunnared medium gray, Kelinge gray-turquoise, Tallmyra blue, Tallmyra dark green, Tallmyra light green, Tallmyra white/black, Tibbleby beige/gray, Tresund anthracite, Tresund light beige"
"KIVIK, Sofa with chaise, Tresund anthracite","1,299",https://www.ikea.com/us/en/p/kivik-sofa-with-chaise-tresund-anthracite-s09482848/,images/kivik.jpg,"Gunnared beige, Gunnared blue, Gunnared light brown-pink, Gunnared light green, Gunnared medium gray, Kelinge gray-turquoise, Tallmyra blue, Tallmyra dark green, Tallmyra light green, Tallmyra white/black, Tibbleby beige/gray, Current variation Tresund anthracite, Tresund light beige"
"KIVIK, Sofa with chaise, Gunnared light green","1,299",https://www.ikea.com/us/en/p/kivik-sofa-with-chaise-gunnared-light-green-s49499700/,images/kivik.jpg,"Gunnared beige, Gunnared blue, Gunnared light brown-pink, Current variation Gunnared light green, Gunnared medium gray, Kelinge gray-turquoise, Tallmyra blue, Tallmyra dark green, Tallmyra light green, Tallmyra white/black, Tibbleby beige/gray, Tresund anthracite, Tresund light beige"
"KIVIK, Sofa with chaise, Tallmyra white/black","1,399",https://www.ikea.com/us/en/p/kivik-sofa-with-chaise-tallmyra-white-black-s39499692/,images/kivik.jpg,"Gunnared beige, Gunnared blue, Gunnared light brown-pink, Gunnared light green, Gunnared medium gray, Kelinge gray-turquoise, Tallmyra blue, Tallmyra dark green, Tallmyra light green, Current variation Tallmyra white/black, Tibbleby beige/gray, Tresund anthracite, Tresund light beige"
"KIVIK, Sofa with chaise, Tallmyra blue","1,399",https://www.ikea.com/us/en/p/kivik-sofa-with-chaise-tallmyra-blue-s49499696/,images/kivik.jpg,"Gunnared beige, Gunnared blue, Gunnared light brown-pink, Gunnared light green, Gunnared medium gray, Kelinge gray-turquoise, Current variation Tallmyra blue, Tallmyra dark green, Tallmyra light green, Tallmyra white/black, Tibbleby beige/gray, Tresund anthracite, Tresund light beige"
"KIVIK, Sofa with chaise, Gunnared medium gray","1,299",https://www.ikea.com/us/en/p/kivik-sofa-with-chaise-gunnared-medium-gray-s09499698/,images/kivik.jpg,"Gunnared beige, Gunnared blue, Gunnared light brown-pink, Gunnared light green, Current variation Gunnared medium gray, Kelinge gray-turquoise, Tallmyra blue, Tallmyra dark green, Tallmyra light green, Tallmyra white/black, Tibbleby beige/gray, Tresund anthracite, Tresund light beige"
"FINNALA, Armrest, Grann/Bomstad black",200,https://www.ikea.com/us/en/p/finnala-armrest-grann-bomstad-black-70455006/,images/finnala.jpg,"Current variation Grann/Bomstad black, Grann/Bomstad golden brown"
"KIVIK, Sofa with chaise, Gunnared blue","1,299",https://www.ikea.com/us/en/p/kivik-sofa-with-chaise-gunnared-blue-s29499701/,images/kivik.jpg,"Gunnared beige, Current variation Gunnared blue, Gunnared light brown-pink, Gunnared light green, Gunnared medium gray, Kelinge gray-turquoise, Tallmyra blue, Tallmyra dark green, Tallmyra light green, Tallmyra white/black, Tibbleby beige/gray, Tresund anthracite, Tresund light beige"
"KIVIK, Sofa with chaise, Tallmyra dark green","1,399",https://www.ikea.com/us/en/p/kivik-sofa-with-chaise-tallmyra-dark-green-s69499695/,images/kivik.jpg,"Gunnared beige, Gunnared blue, Gunnared light brown-pink, Gunnared light green, Gunnared medium gray, Kelinge gray-turquoise, Tallmyra blue, Current variation Tallmyra dark green, Tallmyra light green, Tallmyra white/black, Tibbleby beige/gray, Tresund anthracite, Tresund light beige"
"KIVIK, Sofa with chaise, Gunnared light brown-pink","1,299",https://www.ikea.com/us/en/p/kivik-sofa-with-chaise-gunnared-light-brown-pink-s89499699/,images/kivik.jpg,"Gunnared beige, Gunnared blue, Current variation Gunnared light brown-pink, Gunnared light green, Gunnared medium gray, Kelinge gray-turquoise, Tallmyra blue, Tallmyra dark green, Tallmyra light green, Tallmyra white/black, Tibbleby beige/gray, Tresund anthracite, Tresund light beige"
"KIVIK, Sofa with chaise, Tallmyra light green","1,399",https://www.ikea.com/us/en/p/kivik-sofa-with-chaise-tallmyra-light-green-s99499694/,images/kivik.jpg,"Gunnared beige, Gunnared blue, Gunnared light brown-pink, Gunnared light green, Gunnared medium gray, Kelinge gray-turquoise, Tallmyra blue, Tallmyra dark green, Current variation Tallmyra light green, Tallmyra white/black, Tibbleby beige/gray, Tresund anthracite, Tresund light beige"
"KIVIK, Sectional, 4-seat corner, Gunnared medium gray","1,549",https://www.ikea.com/us/en/p/kivik-sectional-4-seat-corner-gunnared-medium-gray-s09499599/,images/kivik.jpg,"Gunnared beige, Gunnared blue, Gunnared light brown-pink, Gunnared light green, Current variation Gunnared medium gray, Kelinge gray-turquoise, Tallmyra blue, Tallmyra dark green, Tallmyra light green, Tallmyra white/black, Tibbleby beige/gray, Tresund anthracite, Tresund light beige"
"KIVIK, Sectional, 4-seat corner, Tresund anthracite","1,549",https://www.ikea.com/us/en/p/kivik-sectional-4-seat-corner-tresund-anthracite-s79482859/,images/kivik.jpg,"Gunnared beige, Gunnared blue, Gunnared light brown-pink, Gunnared light green, Gunnared medium gray, Kelinge gray-turquoise, Tallmyra blue, Tallmyra dark green, Tallmyra light green, Tallmyra white/black, Tibbleby beige/gray, Current variation Tresund anthracite, Tresund light beige"
"KIVIK, Sectional, 4-seat corner, Tallmyra light green","1,649",https://www.ikea.com/us/en/p/kivik-sectional-4-seat-corner-tallmyra-light-green-s09499603/,images/kivik.jpg,"Gunnared beige, Gunnared blue, Gunnared light brown-pink, Gunnared light green, Gunnared medium gray, Kelinge gray-turquoise, Tallmyra blue, Tallmyra dark green, Current variation Tallmyra light green, Tallmyra white/black, Tibbleby beige/gray, Tresund anthracite, Tresund light beige"
"KIVIK, Sectional, 4-seat corner, Gunnared light brown-pink","1,549",https://www.ikea.com/us/en/p/kivik-sectional-4-seat-corner-gunnared-light-brown-pink-s49499597/,images/kivik.jpg,"Gunnared beige, Gunnared blue, Current variation Gunnared light brown-pink, Gunnared light green, Gunnared medium gray, Kelinge gray-turquoise, Tallmyra blue, Tallmyra dark green, Tallmyra light green, Tallmyra white/black, Tibbleby beige/gray, Tresund anthracite, Tresund light beige"
"KIVIK, Sectional, 4-seat corner, Tallmyra dark green","1,649",https://www.ikea.com/us/en/p/kivik-sectional-4-seat-corner-tallmyra-dark-green-s29499602/,images/kivik.jpg,"Gunnared beige, Gunnared blue, Gunnared light brown-pink, Gunnared light green, Gunnared medium gray, Kelinge gray-turquoise, Tallmyra blue, Current variation Tallmyra dark green, Tallmyra light green, Tallmyra white/black, Tibbleby beige/gray, Tresund anthracite, Tresund light beige"
"KIVIK, Sectional, 4-seat corner, Gunnared light green","1,549",https://www.ikea.com/us/en/p/kivik-sectional-4-seat-corner-gunnared-light-green-s29499598/,images/kivik.jpg,"Gunnared beige, Gunnared blue, Gunnared light brown-pink, Current variation Gunnared light green, Gunnared medium gray, Kelinge gray-turquoise, Tallmyra blue, Tallmyra dark green, Tallmyra light green, Tallmyra white/black, Tibbleby beige/gray, Tresund anthracite, Tresund light beige"
"KIVIK, Sectional, 4-seat corner, Gunnared blue","1,549",https://www.ikea.com/us/en/p/kivik-sectional-4-seat-corner-gunnared-blue-s69499596/,images/kivik.jpg,"Gunnared beige, Current variation Gunnared blue, Gunnared light brown-pink, Gunnared light green, Gunnared medium gray, Kelinge gray-turquoise, Tallmyra blue, Tallmyra dark green, Tallmyra light green, Tallmyra white/black, Tibbleby beige/gray, Tresund anthracite, Tresund light beige"
"FINNALA, Sectional, 4-seat, with chaise/Gunnared medium gray","1,699",https://www.ikea.com/us/en/p/finnala-sectional-4-seat-with-chaise-gunnared-medium-gray-s99319216/,images/finnala.jpg,"With chaise/Dalstorp multicolor, With chaise/Gunnared beige, Current variation With chaise/Gunnared medium gray, With chaise/Orrsta black-blue, With chaise/Tallmyra beige, With chaise/Tallmyra black/gray"
"FINNALA, Sectional, 4-seat, with chaise/Tallmyra beige","1,799",https://www.ikea.com/us/en/p/finnala-sectional-4-seat-with-chaise-tallmyra-beige-s19319220/,images/finnala.jpg,"With chaise/Dalstorp multicolor, With chaise/Gunnared beige, With chaise/Gunnared medium gray, With chaise/Orrsta black-blue, Current variation With chaise/Tallmyra beige, With chaise/Tallmyra black/gray"
"FINNALA, Sectional, 4-seat, with chaise/Orrsta black-blue","1,699",https://www.ikea.com/us/en/p/finnala-sectional-4-seat-with-chaise-orrsta-black-blue-s59319218/,images/finnala.jpg,"With chaise/Dalstorp multicolor, With chaise/Gunnared beige, With chaise/Gunnared medium gray, Current variation With chaise/Orrsta black-blue, With chaise/Tallmyra beige, With chaise/Tallmyra black/gray"
"FINNALA, Sectional, 4-seat, with chaise/Dalstorp multicolor","1,649",https://www.ikea.com/us/en/p/finnala-sectional-4-seat-with-chaise-dalstorp-multicolor-s29319432/,images/finnala.jpg,"Current variation With chaise/Dalstorp multicolor, With chaise/Gunnared beige, With chaise/Gunnared medium gray, With chaise/Orrsta black-blue, With chaise/Tallmyra beige, With chaise/Tallmyra black/gray"
"FINNALA, Sectional, 4-seat, with chaise/Tallmyra black/gray","1,799",https://www.ikea.com/us/en/p/finnala-sectional-4-seat-with-chaise-tallmyra-black-gray-s79319222/,images/finnala.jpg,"With chaise/Dalstorp multicolor, With chaise/Gunnared beige, With chaise/Gunnared medium gray, With chaise/Orrsta black-blue, With chaise/Tallmyra beige, Current variation With chaise/Tallmyra black/gray"
"FINNALA, Sofa, with chaise/Gunnared medium gray","1,599",https://www.ikea.com/us/en/p/finnala-sofa-with-chaise-gunnared-medium-gray-s39319101/,images/finnala.jpg,"With chaise/Dalstorp multicolor, With chaise/Gunnared beige, Current variation With chaise/Gunnared medium gray, With chaise/Orrsta black-blue, With chaise/Tallmyra beige, With chaise/Tallmyra black/gray"
"FINNALA, Sofa, with chaise/Tallmyra beige","1,699",https://www.ikea.com/us/en/p/finnala-sofa-with-chaise-tallmyra-beige-s49319105/,images/finnala.jpg,"With chaise/Dalstorp multicolor, With chaise/Gunnared beige, With chaise/Gunnared medium gray, With chaise/Orrsta black-blue, Current variation With chaise/Tallmyra beige, With chaise/Tallmyra black/gray"
"FINNALA, Sofa, with chaise/Tallmyra black/gray","1,699",https://www.ikea.com/us/en/p/finnala-sofa-with-chaise-tallmyra-black-gray-s09319107/,images/finnala.jpg,"With chaise/Dalstorp multicolor, With chaise/Gunnared beige, With chaise/Gunnared medium gray, With chaise/Orrsta black-blue, With chaise/Tallmyra beige, Current variation With chaise/Tallmyra black/gray"
"FINNALA, Sofa, with chaise/Orrsta black-blue","1,599",https://www.ikea.com/us/en/p/finnala-sofa-with-chaise-orrsta-black-blue-s99319103/,images/finnala.jpg,"With chaise/Dalstorp multicolor, With chaise/Gunnared beige, With chaise/Gunnared medium gray, Current variation With chaise/Orrsta black-blue, With chaise/Tallmyra beige, With chaise/Tallmyra black/gray"
"FINNALA, Sofa, with chaise/Dalstorp multicolor","1,549",https://www.ikea.com/us/en/p/finnala-sofa-with-chaise-dalstorp-multicolor-s09319428/,images/finnala.jpg,"Current variation With chaise/Dalstorp multicolor, With chaise/Gunnared beige, With chaise/Gunnared medium gray, With chaise/Orrsta black-blue, With chaise/Tallmyra beige, With chaise/Tallmyra black/gray"
"KIVIK, Corner sectional, 5-seat w chaise, Tibbleby beige/gray","1,849",https://www.ikea.com/us/en/p/kivik-corner-sectional-5-seat-w-chaise-tibbleby-beige-gray-s99440482/,images/kivik.jpg,"Gunnared beige, Gunnared blue, Gunnared light brown-pink, Gunnared light green, Gunnared medium gray, Kelinge gray-turquoise, Tallmyra blue, Tallmyra dark green, Tallmyra light green, Tallmyra white/black, Current variation Tibbleby beige/gray, Tresund anthracite, Tresund light beige"
"KIVIK, Corner sectional, 5-seat w chaise, Tresund anthracite","2,049",https://www.ikea.com/us/en/p/kivik-corner-sectional-5-seat-w-chaise-tresund-anthracite-s39482875/,images/kivik.jpg,"Gunnared beige, Gunnared blue, Gunnared light brown-pink, Gunnared light green, Gunnared medium gray, Kelinge gray-turquoise, Tallmyra blue, Tallmyra dark green, Tallmyra light green, Tallmyra white/black, Tibbleby beige/gray, Current variation Tresund anthracite, Tresund light beige"
"KIVIK, Corner sectional, 5-seat w chaise, Kelinge gray-turquoise","1,899",https://www.ikea.com/us/en/p/kivik-corner-sectional-5-seat-w-chaise-kelinge-gray-turquoise-s69443024/,images/kivik.jpg,"Gunnared beige, Gunnared blue, Gunnared light brown-pink, Gunnared light green, Gunnared medium gray, Current variation Kelinge gray-turquoise, Tallmyra blue, Tallmyra dark green, Tallmyra light green, Tallmyra white/black, Tibbleby beige/gray, Tresund anthracite, Tresund light beige"
"KIVIK, Corner sectional, 5-seat w chaise, Tallmyra light green","2,199",https://www.ikea.com/us/en/p/kivik-corner-sectional-5-seat-w-chaise-tallmyra-light-green-s39499625/,images/kivik.jpg,"Gunnared beige, Gunnared blue, Gunnared light brown-pink, Gunnared light green, Gunnared medium gray, Kelinge gray-turquoise, Tallmyra blue, Tallmyra dark green, Current variation Tallmyra light green, Tallmyra white/black, Tibbleby beige/gray, Tresund anthracite, Tresund light beige"
"KIVIK, Corner sectional, 5-seat w chaise, Gunnared light brown-pink","2,049",https://www.ikea.com/us/en/p/kivik-corner-sectional-5-seat-w-chaise-gunnared-light-brown-pink-s69499619/,images/kivik.jpg,"Gunnared beige, Gunnared blue, Current variation Gunnared light brown-pink, Gunnared light green, Gunnared medium gray, Kelinge gray-turquoise, Tallmyra blue, Tallmyra dark green, Tallmyra light green, Tallmyra white/black, Tibbleby beige/gray, Tresund anthracite, Tresund light beige"
"KIVIK, Corner sectional, 5-seat w chaise, Tallmyra blue","2,199",https://www.ikea.com/us/en/p/kivik-corner-sectional-5-seat-w-chaise-tallmyra-blue-s89499623/,images/kivik.jpg,"Gunnared beige, Gunnared blue, Gunnared light brown-pink, Gunnared light green, Gunnared medium gray, Kelinge gray-turquoise, Current variation Tallmyra blue, Tallmyra dark green, Tallmyra light green, Tallmyra white/black, Tibbleby beige/gray, Tresund anthracite, Tresund light beige"
"KIVIK, Corner sectional, 5-seat w chaise, Gunnared medium gray","2,049",https://www.ikea.com/us/en/p/kivik-corner-sectional-5-seat-w-chaise-gunnared-medium-gray-s29499621/,images/kivik.jpg,"Gunnared beige, Gunnared blue, Gunnared light brown-pink, Gunnared light green, Current variation Gunnared medium gray, Kelinge gray-turquoise, Tallmyra blue, Tallmyra dark green, Tallmyra light green, Tallmyra white/black, Tibbleby beige/gray, Tresund anthracite, Tresund light beige"
"KIVIK, Corner sectional, 5-seat w chaise, Gunnared light green","2,049",https://www.ikea.com/us/en/p/kivik-corner-sectional-5-seat-w-chaise-gunnared-light-green-s49499620/,images/kivik.jpg,"Gunnared beige, Gunnared blue, Gunnared light brown-pink, Current variation Gunnared light green, Gunnared medium gray, Kelinge gray-turquoise, Tallmyra blue, Tallmyra dark green, Tallmyra light green, Tallmyra white/black, Tibbleby beige/gray, Tresund anthracite, Tresund light beige"
"KIVIK, Corner sectional, 5-seat w chaise, Tallmyra dark green","2,199",https://www.ikea.com/us/en/p/kivik-corner-sectional-5-seat-w-chaise-tallmyra-dark-green-s69499624/,images/kivik.jpg,"Gunnared beige, Gunnared blue, Gunnared light brown-pink, Gunnared light green, Gunnared medium gray, Kelinge gray-turquoise, Tallmyra blue, Current variation Tallmyra dark green, Tallmyra light green, Tallmyra white/black, Tibbleby beige/gray, Tresund anthracite, Tresund light beige"
"FINNALA, Sectional, 5-seat corner, with chaise/Gunnared medium gray","2,849",https://www.ikea.com/us/en/p/finnala-sectional-5-seat-corner-with-chaise-gunnared-medium-gray-s09319268/,images/finnala.jpg,"With chaise/Dalstorp multicolor, With chaise/Gunnared beige, Current variation With chaise/Gunnared medium gray, With chaise/Orrsta black-blue, With chaise/Tallmyra beige, With chaise/Tallmyra black/gray"
"FINNALA, Sectional, 5-seat corner, with chaise/Tallmyra beige","2,999",https://www.ikea.com/us/en/p/finnala-sectional-5-seat-corner-with-chaise-tallmyra-beige-s29319272/,images/finnala.jpg,"With chaise/Dalstorp multicolor, With chaise/Gunnared beige, With chaise/Gunnared medium gray, With chaise/Orrsta black-blue, Current variation With chaise/Tallmyra beige, With chaise/Tallmyra black/gray"
"FINNALA, Sectional, 5-seat corner, with chaise/Tallmyra black/gray","2,999",https://www.ikea.com/us/en/p/finnala-sectional-5-seat-corner-with-chaise-tallmyra-black-gray-s89319274/,images/finnala.jpg,"With chaise/Dalstorp multicolor, With chaise/Gunnared beige, With chaise/Gunnared medium gray, With chaise/Orrsta black-blue, With chaise/Tallmyra beige, Current variation With chaise/Tallmyra black/gray"
"FINNALA, Sectional, 5-seat corner, with chaise/Orrsta black-blue","2,849",https://www.ikea.com/us/en/p/finnala-sectional-5-seat-corner-with-chaise-orrsta-black-blue-s69319270/,images/finnala.jpg,"With chaise/Dalstorp multicolor, With chaise/Gunnared beige, With chaise/Gunnared medium gray, Current variation With chaise/Orrsta black-blue, With chaise/Tallmyra beige, With chaise/Tallmyra black/gray"
"FINNALA, Sectional, 5-seat corner, with chaise/Dalstorp multicolor","2,749",https://www.ikea.com/us/en/p/finnala-sectional-5-seat-corner-with-chaise-dalstorp-multicolor-s09319447/,images/finnala.jpg,"Current variation With chaise/Dalstorp multicolor, With chaise/Gunnared beige, With chaise/Gunnared medium gray, With chaise/Orrsta black-blue, With chaise/Tallmyra beige, With chaise/Tallmyra black/gray"
"SÖDERHAMN, Sectional, 4-seat, with chaise and open end/Viarp beige/brown","1,199",https://www.ikea.com/us/en/p/soederhamn-sectional-4-seat-with-chaise-and-open-end-viarp-beige-brown-s39305825/,images/söderhamn.jpg,"And open end Fridtuna/dark gray, And open end Kelinge/rust, And open end Tonerud/gray, And open end Tonerud/red, And open end/Fridtuna light beige, Current variation With chaise and open end/Viarp beige/brown, With open end Gransel/natural"
"SÖDERHAMN, Sectional, 4-seat with chaise, with open end Gransel/natural","1,119",https://www.ikea.com/us/en/p/soederhamn-sectional-4-seat-with-chaise-with-open-end-gransel-natural-s29442154/,images/söderhamn.jpg,"And open end Fridtuna/dark gray, And open end Kelinge/rust, And open end Tonerud/gray, And open end Tonerud/red, And open end/Fridtuna light beige, With chaise and open end/Viarp beige/brown, Current variation With open end Gransel/natural"
"SÖDERHAMN, Sectional, 4-seat with chaise, and open end Tonerud/gray",939,https://www.ikea.com/us/en/p/soederhamn-sectional-4-seat-with-chaise-and-open-end-tonerud-gray-s49452118/,images/söderhamn.jpg,"And open end Fridtuna/dark gray, And open end Kelinge/rust, Current variation And open end Tonerud/gray, And open end Tonerud/red, And open end/Fridtuna light beige, With chaise and open end/Viarp beige/brown, With open end Gransel/natural"
"SÖDERHAMN, Sectional, 4-seat with chaise, and open end/Fridtuna light beige","1,119",https://www.ikea.com/us/en/p/soederhamn-sectional-4-seat-with-chaise-and-open-end-fridtuna-light-beige-s29449706/,images/söderhamn.jpg,"And open end Fridtuna/dark gray, And open end Kelinge/rust, And open end Tonerud/gray, And open end Tonerud/red, Current variation And open end/Fridtuna light beige, With chaise and open end/Viarp beige/brown, With open end Gransel/natural"
"SÖDERHAMN, Sectional, 4-seat with chaise, and open end Tonerud/red",939,https://www.ikea.com/us/en/p/soederhamn-sectional-4-seat-with-chaise-and-open-end-tonerud-red-s99514473/,images/söderhamn.jpg,"And open end Fridtuna/dark gray, And open end Kelinge/rust, And open end Tonerud/gray, Current variation And open end Tonerud/red, And open end/Fridtuna light beige, With chaise and open end/Viarp beige/brown, With open end Gransel/natural"
"JÄTTEBO, 4-seat mod sofa w chaise, right/Samsala gray/beige","2,450",https://www.ikea.com/us/en/p/jaettebo-4-seat-mod-sofa-w-chaise-right-samsala-gray-beige-s29485209/,images/jättebo.jpg,"Right/Samsala dark yellow-green, Current variation Right/Samsala gray/beige, Right/Tonerud gray"
"JÄTTEBO, 4-seat mod sofa w chaise, right/Tonerud gray","2,350",https://www.ikea.com/us/en/p/jaettebo-4-seat-mod-sofa-w-chaise-right-tonerud-gray-s99485215/,images/jättebo.jpg,"Right/Samsala dark yellow-green, Right/Samsala gray/beige, Current variation Right/Tonerud gray"
"KIVIK, Sectional, 4-seat with chaise, Kelinge gray-turquoise","1,249",https://www.ikea.com/us/en/p/kivik-sectional-4-seat-with-chaise-kelinge-gray-turquoise-s49443063/,images/kivik.jpg,"Gunnared beige, Gunnared blue, Gunnared light brown-pink, Gunnared light green, Gunnared medium gray, Current variation Kelinge gray-turquoise, Tallmyra blue, Tallmyra dark green, Tallmyra light green, Tallmyra white/black, Tibbleby beige/gray, Tresund anthracite, Tresund light beige"
"KIVIK, Sectional, 4-seat with chaise, Tallmyra dark green","1,449",https://www.ikea.com/us/en/p/kivik-sectional-4-seat-with-chaise-tallmyra-dark-green-s09499721/,images/kivik.jpg,"Gunnared beige, Gunnared blue, Gunnared light brown-pink, Gunnared light green, Gunnared medium gray, Kelinge gray-turquoise, Tallmyra blue, Current variation Tallmyra dark green, Tallmyra light green, Tallmyra white/black, Tibbleby beige/gray, Tresund anthracite, Tresund light beige"
"KIVIK, Sectional, 4-seat with chaise, Tresund anthracite","1,349",https://www.ikea.com/us/en/p/kivik-sectional-4-seat-with-chaise-tresund-anthracite-s69494382/,images/kivik.jpg,"Gunnared beige, Gunnared blue, Gunnared light brown-pink, Gunnared light green, Gunnared medium gray, Kelinge gray-turquoise, Tallmyra blue, Tallmyra dark green, Tallmyra light green, Tallmyra white/black, Tibbleby beige/gray, Current variation Tresund anthracite, Tresund light beige"
"KIVIK, Sectional, 4-seat with chaise, Tallmyra white/black","1,449",https://www.ikea.com/us/en/p/kivik-sectional-4-seat-with-chaise-tallmyra-white-black-s49499724/,images/kivik.jpg,"Gunnared beige, Gunnared blue, Gunnared light brown-pink, Gunnared light green, Gunnared medium gray, Kelinge gray-turquoise, Tallmyra blue, Tallmyra dark green, Tallmyra light green, Current variation Tallmyra white/black, Tibbleby beige/gray, Tresund anthracite, Tresund light beige"
"KIVIK, Sectional, 4-seat with chaise, Gunnared blue","1,349",https://www.ikea.com/us/en/p/kivik-sectional-4-seat-with-chaise-gunnared-blue-s29499715/,images/kivik.jpg,"Gunnared beige, Current variation Gunnared blue, Gunnared light brown-pink, Gunnared light green, Gunnared medium gray, Kelinge gray-turquoise, Tallmyra blue, Tallmyra dark green, Tallmyra light green, Tallmyra white/black, Tibbleby beige/gray, Tresund anthracite, Tresund light beige"
